{
  "review_bundle_id": "f660de0e-5a11-5782-ba17-46d096f61d03",
  "review_input": {
    "schema_version": "1.0",
    "legal_map_id": "dd7cea99-1724-5376-bebb-4914fcbd363c",
    "legal_map_hash": "7528b8ce4d03fd29bae4ec91f8f2958fcd2356336ea5aa9088e65fe9bb823a73",
    "renderer_version": "clause-renderer-v1",
    "validator_version_id": "adce47c5-d540-58a9-af04-d4ca86cc452d",
    "validator_config_hash": "d33deb92442865f734deff6cd7facdff466e638516767bbee2955a3883498677",
    "tenant_id": "286ea0c9-1360-5574-84ae-b88f28527610",
    "reset_epoch": 1,
    "company_id": "286ea0c9-1360-5574-84ae-b88f28527610",
    "document_id": "83243ed0-3713-5631-bf48-279cc7a257ec",
    "workflow_id": "beedb39b-bf5b-5e09-8b6a-35d3c847c4ee",
    "proposal_id": "ef28b9a9-1e7a-5f52-b65a-9b5253230a5b",
    "base_revision_id": "76a93b17-2e92-595e-a3c8-c287d24e14aa",
    "base_content_hash": "a6d83f8fbc0f93f006ea20ca9e07ab1100dadcb89934fc9397bf50f2ba8cf632",
    "candidate_revision_id": "72c7ae26-80b8-54ea-8011-92581d79392d",
    "candidate_content_hash": "45424422bab463ec50b34e7c438ac3e4bdaf26c358781f976256b84a0d64b672",
    "diff_id": "d2aad326-ba59-5c68-8534-a609daa98824",
    "diff_hash": "ac6e902a40955a5feb563e6865f4289022362fd00431e29a7fcad84667bd6ee1",
    "context_snapshot_id": "a17614cf-6e6d-53d4-bcde-c202c11cb7b9",
    "context_snapshot_hash": "7b75bedbbb384b01e95f9fc18b59871a799d123e3bfbe1c0eb16f62acdd55180",
    "evidence_bundle_id": "a9b77d62-9fa8-5750-8a83-54860d735e72",
    "evidence_bundle_hash": "48736e58b409ed0241c8d7bed9dc188a59e13002f48e7492850bec15b59147b6",
    "assessment_id": "f3da5553-1b34-5a27-b38a-83cf133f015e",
    "assessment_hash": "b11e9e0b988f29a9756a4036e4217617d90fa7fbf3e47d2d43f19b0674df680f",
    "run_id": "736f1ec2-a823-5cee-a45a-78edbe1660e6",
    "harness_version_id": "0e22688c-c435-5ebd-80b1-8c620de42e72",
    "harness_hash": "55ae38bb5f2fe51359774c8501e8540ac573d21d04536742a7c75222f64d7a1c",
    "material_context_epoch": 4,
    "material_evidence_epoch": 2,
    "source_recheck_attestation_ids": [],
    "freshness_valid_until": "2026-09-27T17:00:00Z"
  },
  "review_input_hash": "b12dbe1ed1ad1d4edac5b8a083eae354e0a61f1ae33c7dbfb5b53244ae3568a5",
  "validation_run_id": "ba6d6530-e544-54d7-bcc6-add9fdecfb88",
  "validation_hash": "0274f6dfc9506d639154791ecf4a8ca528807da6f2b41fbf564313d4480e232b",
  "validator_version_id": "adce47c5-d540-58a9-af04-d4ca86cc452d",
  "sealed_at": "2026-09-26T17:00:00Z",
  "review_bundle_hash": "b6bb1be4cb8042468237df24a4279dfda54c30840f3c46d24ca7ed6feacf1349"
}
